{
  "correlation_id": "synthetic-single",
  "event_type": "SYNTHETIC_SINGLE_EVENT",
  "message_type": "",
  "metadata": {
    "correlation_phase": "SINGLE",
    "fixture_scope": "SYNTHETIC_OFFLINE_FIXTURE",
    "synthetic": true
  },
  "monotonic_timestamp": 0.0,
  "result": "OBSERVED",
  "scenario_id": "SITL-NORMAL-900",
  "schema_version": "1.0.0",
  "source": "synthetic_harness",
  "state_after": "BOOT",
  "state_before": "BOOT",
  "target": "offline_assertion_runner",
  "timestamp": "2026-01-01T00:00:00Z",
  "topic": ""
}
